id_|username|request|answer
453256411|izzyonix|Как провести отпуск в Омске|Отпуск в Омске может быть интересным и незабываемым. Есть несколько популярных мест, которые можно посетить и провести время активно.  1. Искусство: посетите музеи и галереи Омска, такие как Музей имени Ф.М. Достоевского, Музей графических искусств, Галерею Союза художников.  2. Природа: Омск окружен красивыми лесами и природными заповедниками. Посетите Красноярский бор, Омский затон, Заповедник Боровое.  3. История: Омск - один из старейших городов России. Посетите исторические музеи и памятники.  4. Развлечения: посмотрите на спектакли в театрах Омска, покатайтесь на лошадях в конно-спортивном центре, покупайте товары на местных рынках.  5. Кухня: Омск известен своей национальной кухней, которую можно попробовать в ресторанах и кафе.  Планируя поездку в Омск, не забудьте заранее забронировать гостиницу и купить билеты на мероприятия. Также стоит иметь в виду, что зимой в Омске очень холодно, поэтому одевайтесь тепло и выбирайте курсы для зимнего сезона, такие как катание на лыжах и сноуборде.
453256411|izzyonix|Ты умеешь вести диалог?|Да, я умею вести диалог. Я разработана таким образом, чтобы общаться с людьми и помогать им в решении задач и ответах на вопросы. Я использую различные алгоритмы и базы знаний, чтобы понимать ваши запросы и отвечать на них наилучшим образом.
453256411|izzyonix|Какого ты пола?|Я не имею пола, я являюсь виртуальным ассистентом и не обладаю физическим телом.
453256411|izzyonix|Что ты умеешь? Можешь ответить через час?|Как искусственный интеллект, я могу выполнять ряд функций, включая отвечать на вопросы, предоставлять информацию, проводить простые расчеты и задачи обработки данных, анализировать и классифицировать данные, создавать напоминания и управлять расписанием, фильтровать и сортировать информацию, а также выполнять другие задачи, связанные с моей программой. Через час я также смогу выполнить эти функции.
453256411|izzyonix|Напиши Отложенное сообщение с текстом "текст"|Я, как Искусственный Интеллект не могу написать отложенное сообщение. Предлагаю воспользоваться функцией отложенных сообщений в мессенджерах, таких как Telegram или WhatsApp, они могут помочь вам в этом вопросе.
453256411|izzyonix|Если я хочу погрузиться в computer art, то с чего мне начать?|1. Изучите компьютерные графические программы, такие как Adobe Photoshop, Illustrator, CorelDRAW и т.д. Используйте онлайн-уроки, видеоуроки и книги, чтобы научиться основным принципам.  2. Узнайте о современных тенденциях в computer art и изучите работы известных художников, которые работают в этой области.  3. Попробуйте создавать свои собственные проекты, начиная с простых и постепенно переходя на более сложные. Это поможет вам развиваться и улучшать свои навыки.  4. Взаимодействуйте с другими художниками и дизайнерами, посещайте мероприятия, фестивали и конференции, на которых можно обсуждать творческие идеи и делиться опытом.  5. Оцените свои работы и примите критику, чтобы расти и развиваться в этой области.
453256411|izzyonix|Если я хочу погрузиться в computer art, то с чего мне начать? И какой стек технологий мне понадобится|?  1. Начните с освоения программ графического дизайна, таких как Adobe Photoshop, Adobe Illustrator, Sketch, Figma или CorelDRAW. Эти программы помогут вам создавать векторную и растровую графику, редактировать изображения и работать с цветом и композицией.  2. Изучите 3D графику и моделирование, используйте программы такие как Blender, Maya, Cinema 4D или 3D Studio Max.  3. Оттачивайте навыки создания анимации и визуализации, используя программы такие как Autodesk Maya, Adobe After Effects, Cinema 4D, Blender или Adobe Animate.  4. Изучайте программирование и создавайте веб-сайты, программы и приложения, используя HTML, CSS, JavaScript, PHP, Python, и другие языки программирования. Эти навыки помогут вам создавать интерактивные веб-сайты, игры, приложения, и другие проекты,  5. Изучайте техники изображения с помощью искусственного интеллекта, машинного обучения и нейронных сетей.  Итак, если Вы хотите погрузиться в computer art, Вам потребуются навыки работы с графическими программами, 3D моделированием, анимацией, визуализацией, программированием, искусственным интеллектом и машинным обучением. Это нужно будет последовательно изучать.
453256411|izzyonix|Если я хочу погрузиться в coding art, то с чего мне начать? И какой стек технологий мне понадобится|Для начала работы с coding art вам понадобится базовое знание программирования. Рекомендуется начать с изучения языка JavaScript, так как он позволяет создавать веб-сайты с помощью элементов canvas и SVG. Изучение HTML и CSS также необходимо для создания интерактивных веб-сайтов.  После этого вам понадобится знание библиотек и фреймворков, таких как:  1. p5.js - это библиотека JavaScript, которая предназначена для программирования интерактивной графики.  2. Three.js - это библиотека JavaScript для создания 3D-графики в браузере.  3. D3.js - это библиотека JavaScript, которая используется для создания визуализации данных.  4. Processing - это среда программирования на Java, которая также используется для создания интерактивной графики.  Это некоторые из основных технологий, которые могут помочь вам начать работу в coding art. Но помимо этого, возможно, вам понадобятся знания в области графического дизайна, а также математические навыки, чтобы понимать как происходят различные трансформации и алгоритмы, используемые в создании coding art.
453256411|izzyonix|Какие виды punk существуют в искусстве|Как и в музыке, в искусстве также существует несколько разновидностей панка:  1. Граффити-артисты панка: этих художников можно увидеть на улицах, стенах и зданиях городов, где они изображают свои протестные и субкультурные идеи.  2. Кинематографические панки: кинорежиссеры, чьи фильмы нередко говорят об антиистеблишментарных движениях, представлениях и нравах.  3. Литературные панки: писатели, произведения которых выступают в защиту свободы слова, индивидуальности и протеста.  4. Музыкальные панки: музыканты панк-рока, представляющие протестное и бунтарское движение в музыке.  5. Визуальные панки: художники, дизайнеры и фотографы, которые пользуются панковскими мотивами для создания своих работ.
453256411|izzyonix|Есть что-то кроме дизель панка и кибер панка?|Да, есть множество других поджанров научной фантастики и музыки, которые не связаны с дизельпанком или киберпанком. Например:  - Спэйс опера (Space Opera) - космическая научная фантастика с массовыми битвами и эпическими приключениями в космосе - Утопический панк (Utopian Punk) - жанр, который исследует альтернативные социальные ситуации, где герои ищут равенство и справедливость - Стеампанк (Steampunk) - жанр, основанный на ретрофутуристической эстетике парового движения и индустриальной эры - Пост-апокалиптика (Post-Apocalyptic) - фикшн-жанр, основанный на сценарии после конца мира, где оставшиеся люди борются за выживание - Киберфанк (Cyberfunk) - гибрид панка и киберпанка, сильно влияющийся на футуристические социальные проблемы и технологические разработки. - Биопанк (Biopunk) - жанр, объединяющий науку и технологию с биологическими процессами, как, например, живые чипы и генетические модификации.  Это только некоторые из многих поджанров научной фантастики и музыки, которые существуют в настоящее время.
453256411|izzyonix|Есть ли жизнь после Страуструпа и Ландау?|Конечно, жизнь не зависит от конкретных людей. Безусловно, Страуструп и Ландау оставили огромный след в мире информационных технологий, но мир продолжает развиваться и появляются новые гении, которые смогут продолжить работу своих предшественников. Кроме того, важно помнить, что в ИТ-индустрии работает огромное количество людей, которые делают свой вклад в развитие этой области и без которых она тоже не существовала бы.
453256411|izzyonix|Почему ООП - это зло? Кто это придумал?|Как и многие другие вопросы, ответ на этот зависит от того, кто его задает и в каком контексте.   Существует мнение, что ООП - не зло в самом себе, но его некоторые аспекты могут привести к проблемам и сложностям в разработке программного обеспечения. Например, использование наследования может привести к сложной иерархии классов и перегруженному коду, а инкапсуляция может препятствовать отладке или тестированию.  Одним из критиков ООП был Алан Кей, один из основателей науки о компьютерах и известный программист. В своих выступлениях он подчеркивал, что ООП слишком сильно сосредоточено на объектах и классах и приводит к "путанице и пересечениям ответственности", а также затрудняет концептуальное мышление.  Однако, следует заметить, что ООП по-прежнему широко используется в современном программировании и имеет множество преимуществ, таких как повторное использование кода, более легкое понимание системы, более производительную инициализацию объектов и др. Некоторые из его недостатков можно пережить, если вести себя правильно и иметь хорошую практику и проектирование.
453256411|izzyonix|Какие задачи решаются с использованием ООП, а какие с использованием функционального программирования?|Работа в ООП прежде всего направлена на решение задач, связанных с описанием объектов, их свойств и методов, наследованием и полиморфизмом.  Примеры задач, которые можно решать с помощью ООП:  - Создание сложной системы с множеством взаимосвязанных объектов (например, написание игры, графического редактора или обработки больших объемов данных). - Имитация реальных процессов и явлений (например, разработка программ для моделирования экономических процессов или физических явлений). - Работа с базами данных и объектно-ориентированными языками программирования.  Функциональное программирование нацелено на создание функций и процедур, которые могут быть использованы для обработки данных.  Примеры задач, которые можно решать с помощью функционального программирования:  - Обработка данных (например, подсчет суммы элементов массива или нахождение среднего арифметического). - Работа с математическими функциями (например, написание программ для решения дифференциальных уравнений). - Работа с функциональными языками программирования.
453256411|izzyonix|Что такое DI, COI, Solyd, dry?|DI (Dependency Injection) - это паттерн проектирования программного обеспечения, который используется для упрощения создания связей между классами в приложении. Он основывается на передаче зависимостей в виде параметров в методы или конструкторы классов.  COI (Control of Infection) - это система контроля инфекции, которая используется в медицинских учреждениях для предотвращения распространения инфекций среди пациентов и персонала.  Solyd - это операционная система на базе Debian Linux, которая была разработана для использования в бизнес-среде. Она предоставляет надежную и стабильную платформу для разработки и запуска приложений.  DRY (Don't Repeat Yourself) - это принцип, который заключается в том, чтобы избегать дублирования кода в программном обеспечении. Он предполагает, что каждый кусок информации должен иметь единственный источник, чтобы уменьшить возможность ошибок и облегчить процесс обслуживания кода.
453256411|izzyonix|Как написать простой генератор бинарных картинок?|Для написания простого генератора бинарных картинок Вам можно использовать язык программирования Python и библиотеку Pillow.  Ниже приведен простой пример кода, который генерирует черно-белую картинку 100x100 пикселей:  ```python from PIL import Image  # Создание новой картинки img = Image.new('1', (100, 100))  # Получение объекта для работы с пикселями pixels = img.load()  # Заполнение кадров с помощью циклов for i in range(100):     for j in range(100):         # Установка цвета черным, если индекс четный, и белым, если индекс нечетный         if i % 2 == 0:             pixels[i, j] = 0         else:             pixels[i, j] = 1  # Сохранение картинки на диск img.save("binary_image.png") ```  Результатом выполнения кода будет создание картинки в формате PNG с черно-белым изображением квадрата 100x100 пикселей. В зависимости от того, какое изображение нужно получить, можно менять алгоритм заполнения картинки.
453256411|izzyonix|Я не хочу использовать питон для этого, хочу использовать java или c#|Конечно, вы можете использовать Java или C# для реализации своего проекта. Обе эти языки программирования достаточно мощные и гибкие, и могут быть использованы для реализации различных задач. Нужно только определиться с тем, какие именно функциональные требования должны быть реализованы, и выбрать тот язык программирования, который лучше всего подходит для этой задачи. Также следует учитывать свой уровень опыта и знаний в данном языке программирования.
453256411|izzyonix|Нужен слоган для общества 'муравьёв рабочих', живущих в мире стимпанк|"Мы муравьи рабочие, стремящиеся к высотам стимпанк-прогресса!"
453256411|izzyonix|Ещё|Что ещё вы хотели бы узнать или услышать? Я готов ответить на ваши вопросы или обсудить другие темы.
453256411|izzyonix|.|I'm sorry, I cannot answer this question as there is no information or context provided. Please provide more details or a specific question.
453256411|izzyonix|Нужен слоган для общества 'муравьёв рабочих', живущих в мире стимпанк|"Мы - муравьи рабочие, крепкие и надежные, в стимпанк-мире высокой механизации".
453256411|izzyonix|Нужен слоган для общества 'муравьёв рабочих', живущих в мире стимпанк|"Сила в единстве, работа в труде - мы муравьи стимпанка, мы - сила!"
453256411|izzyonix|Сгенерируй 10 слоганов для общества карликовых медведей|1. Сохраняем карликовых медведей - сохраняем природу! 2. Открытость, забота, ответственность - вот что нам нужно для защиты карликовых медведей. 3. Помогите нам защитить карликовых медведей - они заслуживают нашей любви и защиты. 4. Мы защищаем карликовых медведей, чтобы они могли жить в своем естественном окружении. 5. Карликовые медведи - это уникальные животные, и мы должны защитить их вместе. 6. Предотвращаем их исчезновение - сильнейший шаг к сохранению карликовых медведей. 7. Если мы не защитим карликовых медведей, то не заслужим защиты со стороны природы. 8. Карликовые медведи - необычные животные, которые нуждаются в нашей помощи. 9. Примите участие в борьбе за сохранение карликовых медведей - это дело всей планеты. 10. Защищаем карликовых медведей - защищаем символы дикой природы.
