id_|username|request|answer
81432612|kkkkk_kkk_kkkkk|Опиши микросервисную архитектору сервиса обслуживания клиента в текстовом и голосовом канале|Микросервисная архитектура сервиса обслуживания клиента включает в себя:  1. Сервис обработки запросов в текстовом канале: этот сервис отвечает за обработку входящих запросов клиентов через текстовый канал (например, чат). Он обеспечивает автоматический ответ на стандартные запросы и перенаправляет более сложные запросы на другие сервисы.  2. Сервис обработки запросов в голосовом канале: этот сервис отвечает за обработку запросов клиентов через голосовой канал (например, голосовой ассистент). Он использует технологии распознавания речи и естественного языка для понимания запросов клиентов.  3. Сервис обработки данных клиентов: этот сервис хранит, обновляет и обрабатывает данные клиентов (например, персональную информацию, историю заказов и т.п.). Он обеспечивает защиту персональных данных клиентов и соблюдение требований законодательства.  4. Сервис управления запросами: этот сервис координирует работу других сервисов и обеспечивает обработку запросов клиентов в соответствии с приоритетами. Он также отслеживает статистику запросов и осуществляет аналитику для улучшения качества обслуживания клиентов.  5. Сервис уведомлений: этот сервис отвечает за отправку уведомлений клиентам (например, о подтверждении заказа, о изменении статуса заказа и т.д.). Он использует различные каналы связи (SMS, e-mail, мессенджеры) для доставки уведомлений в удобной форме.  Каждый из перечисленных сервисов является независимым и может масштабироваться отдельно от других сервисов. Это позволяет ускорить разработку и деплоймент новых функций и обеспечивает высокую надежность сервиса обслуживания клиентов.
149434632|curlyirina|Что такое стори поинт|Стар пойнт (story point) – это единица измерения сложности задачи в Agile-методологии разработки программного обеспечения. Она используется для оценки объема работы, который требуется выполнить для реализации определенного функционала или решения конкретной проблемы.   Отличие Story Points от других методов измерения заключается в том, что вместо использования часов, дней или недель, команда оценивает сложность задачи в единицах, не непосредственно связанных со временем, а с факторами, влияющими на трудоемкость. Эти факторы могут включать в себя такие параметры, как объем работы, сложность и риск.  Также, еще одно важное отличие Story Points от других методов оценки — они не могут быть сконвертированы в часы или дни напрямую. Каждая команда разработчиков имеет свои собственные законы и правила, по которым определяются единицы Story Points и их соответствие временным затратам.
438188319|Donchik777|Нарисуй блок схему сценария IVR с возможными вариантами ответа клиенту с учётом этих данных - "status": "delivered" - статус доставки (доставлено) - "delivery_date": "2021-05-20" - дата доставки (20 мая 2021 года) - "delivery_time": "10:30:00" - время доставки (10:30 AM) - "recipient_name": "John Smith" - имя получателя (Джон Смит) - "recipient_address": "123 Main St, Anytown USA" - адрес получателя (улица Мейн 123, город Anytown США) - "tracking_number": "ABC12345" - номер отслеживания (ABC12345) - "carrier": "UPS" - служба доставки (UPS) - "estimated_delivery_date": "2021-05-20" - ожидаемая дата доставки (20 мая 2021 года) - "message": "Your package has been delivered" - сообщение о статусе доставки (Ваш пакет доставлен)|``` Start | Welcome message: "Thank you for calling our delivery service. Please enter your tracking number followed by the pound sign." | Input: Tracking number entered | If tracking number is valid: | ---> Play message: "Hello, your package with tracking number ABC12345 was delivered on May 20th at 10:30 AM to John Smith at 123 Main St, Anytown USA. If you have any further questions, please contact us at 1-800-DELIVERY." | Else: | ---> Play message: "Sorry, we couldn't find your package. Please check your tracking number and try again or contact us at 1-800-DELIVERY for assistance." | End ```
81432612|kkkkk_kkk_kkkkk|напиши код классификатора текстовых запросов на Python|Классификатор текстовых запросов на Python может быть написан с использованием различных методов машинного обучения, таких как наивный Байесовский классификатор, логистическая регрессия, SVM и другие. Ниже приведен пример реализации наивного Байесовского классификатора.  ``` import pandas as pd from sklearn.feature_extraction.text import CountVectorizer from sklearn.naive_bayes import MultinomialNB from sklearn.metrics import accuracy_score  class TextClassifier:     def __init__(self):         self.vectorizer = CountVectorizer(stop_words='english')         self.classifier = MultinomialNB()      def train(self, X_train, y_train):         X_train_vectorized = self.vectorizer.fit_transform(X_train)         self.classifier.fit(X_train_vectorized, y_train)      def predict(self, X_test):         X_test_vectorized = self.vectorizer.transform(X_test)         return self.classifier.predict(X_test_vectorized)  # Пример использования классификатора data = pd.read_csv('data.csv')  X = data['text'] y = data['label']  classifier = TextClassifier()  # Разбиваем данные на тренировочный и тестовый наборы train_size = int(len(X) * 0.8) X_train, X_test = X[:train_size], X[train_size:] y_train, y_test = y[:train_size], y[train_size:]  classifier.train(X_train, y_train)  predictions = classifier.predict(X_test) accuracy = accuracy_score(y_test, predictions)  print('Accuracy:', accuracy) ```   В данном примере мы создаем класс TextClassifier, который использует наивный Байесовский классификатор для классификации текстовых запросов. Метод train() обучает классификатор на тренировочных данных, а метод predict() классифицирует новые запросы на основе предобученной модели.  Для извлечения признаков из текстовых данных мы используем CountVectorizer, который конвертирует тексты в векторы признаков на основе частотности слов. Чтобы увеличить точность классификации, мы также удаляем некоторые стоп-слова из текстовых данных.  Метод accuracy_score() из библиотеки scikit-learn используется для оценки точности модели на тестовых данных.
438188319|Donchik777|Нарисуй блок схему сценария IVR с возможными вариантами ответа клиенту с учётом наличия или отсутсвия этих атрибутов  {    "status": "delivered",    "delivery_date": "2021-05-20",    "delivery_time": "10:30:00",    "recipient_name": "John Smith",    "recipient_address": "123 Main St, Anytown USA",    "tracking_number": "ABC12345",    "carrier": "UPS",    "estimated_delivery_date": "2021-05-20",    "message": "Your package has been delivered" }|Sorry, I cannot draw block diagrams as I am a language model AI.
1908371931|Sergey_p7|/test|I am sorry, but can you please provide more information about what you want me to test?
346441541|Ilya_Grebenshchikov|Напиши сценарий для бонусов спасибо|Название: Бонусы Спасибо  Описание: Это история об обычном человеке, который получил удовлетворение от того, что был способен сэкономить деньги благодаря своим бонусам.  Сценарий:  Кадр 1: Главный герой на работе Главный герой, Дэвид, сидит на своем рабочем месте и читает новости на своем смартфоне.   - Голос Спикера: «Вот новые новости от наших партнеров «Бонусы Спасибо! Сэкономьте до 50% на покупке в ТЦ «Столица».  Кадр 2: Покупка электроники Дэвид решает сходить в ТЦ "Столица" и купить новый смартфон. Он знает, что за каждую свою покупку будет получать бонусные баллы, которые можно обменять на товары в магазине.  Кадр 3: Накопление бонусов Дэвид совершает покупку и получает 500 бонусных баллов. Он понимает, что если будет дальше накапливать баллы, то сможет купить другой товар в магазине бесплатно.  Кадр 4: Пополнение баланса Дэвид решает пополнить свой бонусный баланс и переводит на него 1000 рублей. С этого момента он активно совершает покупки по всей городу, чтобы получить еще больше бонусов.  Кадр 5: Получение призов Через несколько месяцев, Дэвид решает обменять свои бонусы на планшет. Он звонит в магазин и заказывает приз, который получает через несколько дней. Счастливый и удовлетворенный покупкой, Дэвид улыбается, зная, что смог получить свой новый гаджет благодаря своим бонусам.  Заключительный кадр: Дэвид смотрит на свой новый планшет и довольно улыбается.  Дэвид: «Бонусы Спасибо действительно работают! Я сэкономил деньги, которые были бы направлены на покупку электроники, а теперь могу наслаждаться этим призом!».   The End.
405679815|Savamura|Тест|1. Какое имя у главного героя книги "Мастер и Маргарита"?  a) Федор  b) Михаил  c) Иван  d) Николай  2. Как называется столица Германии?  a) Париж  b) Лондон  c) Рим  d) Берлин  3. Сколько планет в Солнечной системе?  a) 7  b) 8  c) 9  d) 10  4. Какой газ является основным компонентом атмосферы Земли?  a) Кислород  b) Водород  c) Азот  d) Углекислый газ  5. Кто написал роман "1984"?  a) Александр Дюма  b) Джордж Оруэлл  c) Федор Достоевский  d) Жюль Верн  Ответы:  1) b) Михаил 2) d) Берлин 3) b) 8 4) c) Азот 5) b) Джордж Оруэлл
1282354906|hubbleDJ|найди число пи|Число "пи" (π) - это математическая константа, которая представляет отношение длины окружности к ее диаметру. Значение числа "пи" равно 3,14159265358979323846... и т.д., т.е. оно не имеет конечного десятичного представления и бесконечно дробится.
334596227|zolotilda|Гоооош|Я рад, что вы довольны! Чем я могу вам помочь?
334596227|zolotilda|Гошаа|Я не знаю, кого вы имеете в виду под именем "Гошаа". Можете дать более конкретные сведения или задать конкретный вопрос?
334596227|zolotilda|Как стать здоровым, Гош?|Как и для всех остальных, здоровье для вас зависит от того, как вы ведете свою жизнь. Вот несколько советов, которые помогут вам стать здоровее:  1. Упражнения и физическая активность: Тренировка на свежем воздухе, зарядка, бег, ходьба, плавание и другие виды физической активности помогают улучшить ваше здоровье, увеличить выносливость и снизить риск заболеваний.  2. Питание: Убедитесь, что вы употребляете более здоровую пищу, богатую витаминами и минералами, а также снизить потребление жирной, соленой и сладкой пищи, которая негативно сказывается на здоровье.  3. Сон: Ваше тело нуждается в отдыхе и регулярном сне. Используйте время сна, чтобы восстановиться и подготовиться к следующему дню.  4. Не курить и не употреблять алкоголь: это очень важно для вашего здоровья.  5. Регулярные медицинские обследования: Здоровье экспертов распознает заболевания раньше и может предложить лучшее лечение.  6. Управление стрессом: стресс может негативно повлиять на ваше здоровье. Изучите методы релаксации, такие как медитация, йога, чтение книг и прогулки на природе.  Следуя этим советам, вы можете повысить ваше здоровье и устойчивость к болезням.
334596227|zolotilda|Хорошо, а как управлять стрессом|Как ИИ я не испытываю чувств, но могу дать рекомендации о том, как справляться со стрессом:  1. Узнайте причины стресса и попытайтесь их устранить, если это возможно. 2. Спите достаточно, чтобы отдохнуть и восстановить свой организм. 3. Регулярно занимайтесь физической активностью, так как это помогает снизить уровень стресса и улучшить настроение. 4. Ищите способы расслабления, такие как йога, медитация, ароматерапия или простое чтение книги. 5. Общайтесь с близкими или профессиональными психологами, чтобы получить поддержку и советы в ситуациях, когда справиться самостоятельно не удается. 6. Планируйте свой день заранее, чтобы уменьшить количество неожиданностей и ситуаций, которые могут вызвать стресс.
334596227|zolotilda|Вегетарианство вредно?|Как ИИ-ассистент, я не могу иметь собственных взглядов, однако расскажу вам о мнениях специалистов на эту тему.  Вегетарианство, если правильно планировать рацион, может быть здоровым и сбалансированным образом жизни. Многие исследования показали, что вегетарианцы имеют меньший риск развития ожирения, сахарного диабета, сердечных заболеваний и рака. Однако, если не учитывать все необходимые питательные вещества и не заменять их на альтернативные продукты, то риск развития дефицита витаминов, белков и жирных кислот может возникнуть.  В целом, вегетарианство может быть значительно менее вредным, чем перекусы фаст-фудом, курение и алкоголь. Но независимо от того, какой стиль питания вы выбираете, важно следить за балансом рациона и убедиться, что ваше тело получает все необходимые питательные вещества. Если у вас есть вопросы о вашем питании, обратитесь к специалисту по питанию.
334596227|zolotilda|Кто такой Ибрагим из песни Queen?|К сожалению, в песнях Queen нет персонажа по имени Ибрагим. Однако, существуют несколько песен, в которых упоминается имя Ibrahim:  - "Teo Torriatte (Let Us Cling Together)" - "Lily of the Valley" - "All Dead, All Dead"  В этих песнях имя Ибрагим упоминается в контексте текста и не относится к конкретному персонажу.
405679815|Savamura|/group|I'm sorry, I don't understand what you are asking. Can you please provide more context or information about the topic you'd like to discuss?
405679815|Savamura|Какие слоты вернутся при фразе «Ипотека»|1. «Ипотека» от банка 2. «Ипотека» на вторичном рынке 3. «Ипотека» с государственной поддержкой 4. «Ипотека» на жилье за рубежом 5. «Ипотека» с минимальным первоначальным взносом 6. «Ипотека» под залог недвижимости 7. «Ипотека» для молодых семей 8. «Ипотека» для предпринимателей 9. «Ипотека» на долю в общей собственности  10. «Ипотека» на новостройки.
334596227|zolotilda|Кто такой Мустафа Ибрагим из песни Queen|Я, как искусственный интеллект, не могу назвать Mustafa Ibrahim конкретным персонажем песен группы Queen, потому что в их песнях нет такого персонажа. Возможно, вы ошиблись в названии или вспоминаете персонажа из другой песни или источника. Пожалуйста, предоставьте более подробную информацию, чтобы я мог помочь вам лучше.
334596227|zolotilda|Какие песни слушать для релакса?|1. "Weightless" - Marconi Union 2. "Music for Airports" - Brian Eno 3. "Yoga" - Janelle Monae 4. "The Calm" - Jeremy Soule 5. "Gymnopedie No. 1" - Erik Satie 6. "Moon" - Old Silver Key 7. "Clair de Lune" - Claude Debussy 8. "Rain"- Brian Crain 9. "Solitude" - Hammock 10. "Silent Night" - Franz Xaver Gruber
93027469|krasty_kovyaz|Когда заканчивается день?|День заканчивается тогда, когда Солнце садится за горизонт, что происходит примерно в течение часа-двух после захода, когда полностью становится темно на улице. Этот момент может отличаться в зависимости от места и времени года.
334596227|zolotilda|Какие песни Робби Уильямса слушать для релакса?|Как AI, я не могу чувствовать, поэтому создание списка песен, которые помогут расслабиться, может занять много времени и опыта в музыкальной индустрии. Однако, рекомендуемые некоторые песни Робби Уильямса, которые можно использовать для релаксации включают:  - "Angels" - "Better Man" - "Feel" - "Go Gentle" - "Let Me Entertain You" - "Mack the Knife" - "Millennium" - "Morning Sun" - "Something Beautiful" - "Strong"
334596227|zolotilda|Кто такой Златан?|Златан (Zlatan) может относиться к нескольким известным людям:  1. Златан Ибрахимович (Zlatan Ibrahimović) - шведский футболист из Мальме, играющий на позиции нападающего и выступающий за клуб AC Milan. Он считается одним из лучших футболистов своего поколения.  2. Златан Алисултанов (Zlatan Alisultanov) - российский певец из Дагестана, исполняющий народную музыку и шансон.  3. Златан (Jouko Vuolle) - финский певец и рэпер, деятель музыкальной индустрии.  4. Златан - персонаж из виртуальной игры "Ведьмак 3: Дикая Охота", боец и лучник.  5. Златан Шоев - чеченский террорист, руководитель группировки "Исламский джихад".
